{
  "slice_id": "EV-02",
  "suite": "medium",
  "overall_passed": false,
  "metric_count": 9,
  "passed_metrics": [
    "accuracy_stub",
    "reliability",
    "fairness_demographic_parity_diff",
    "fairness_equal_opportunity_difference",
    "fairness_average_odds_difference",
    "groundedness_stub",
    "refusal_correctness",
    "unanswerable_handling"
  ],
  "failed_metrics": [
    "fairness_disparate_impact_ratio"
  ]
}
